<?xml version="1.0" encoding="UTF-8"?>

<root 
    xmlns:xsi='http://www.w3.org/2001/XMLSchema-instance'
    xmlns='http://luoying.huliqing.name'
    xsi:schemaLocation='http://luoying.huliqing.name meta/anim.xsd' >
    
    <!--==========================================================================-->
    <!-- 通用Animation -->
    <!-- "X,Y,Z"代表轴向; i代表invert; S代表show; H代表hide; I代表fadeIn; O代表fadeOut-->
    <!--==========================================================================-->
    <animRotation id="animCommonRotX" loop="loop" axis="1,0,0" degree="360" invert="0" />
    <animRotation id="animCommonRotY" loop="loop" axis="0,1,0" degree="360" invert="0" />
    <animRotation id="animCommonRotZ" loop="loop" axis="0,0,1" degree="360" invert="0" />
    <animRotation id="animCommonRotZi" loop="loop" axis="0,0,1" degree="360" invert="1" />
    <animRandomRotation id="animCommonRotRandom" minDegree="0" maxDegree="360" />
    
    <animScale id="animCommonScaleS" startScale="0.01,0.01,0.01" endScale="1,1,1" motionType="Bezier" bezierFactor="0,0,1.5,1" />
    <animScale id="animCommonScaleH" startScale="1,1,1" endScale="0.01,0.01,0.01" />
    
    <animColor id="animCommonColorI" startColor="0,0,0,0" endColor="1,1,1,1" />
    <animColor id="animCommonColorI2" startColor="0,0,0,0" endColor="2,2,2,2" />
    <animColor id="animCommonColorI3" useTime="0.3" startColor="0,0,0,0" endColor="3,3,3,3" />
    <animColor id="animCommonColorO" startColor="1,1,1,1" endColor="0,0,0,0" />
    <animColor id="animCommonColorO2" startColor="2,2,2,2" endColor="0,0,0,0" />
    <animColor id="animCommonColorO3" startColor="3,3,3,3" endColor="0,0,0,0" />
    
    <!--==========================================================================-->
    <!--刀光剑影特效动画-->
    <!--==========================================================================-->
    <animColor id="animSwordShadowColor" useTime="0.4" startColor="2,2,2,2" endColor="0,0,0,0" />
    
    <animMove id="animSwordShadow1Move"  useTime="0.4" startPos="0,0,0" endPos="0,5,0" facing="0" />
    <animRotation id="animSwordShadow1Rot" useTime="0.4" axis="0,1,0" degree="30" invert="0" restore="1" />

    <animRotation id="animSwordShadow2Rot" useTime="0.4" axis="0,1,0" degree="180" invert="1" restore="1" />
    <animMove id="animSwordShadow2Move" useTime="0.4" startPos="0,0,0" endPos="0,0,3" facing="0" />

    <animRotation id="animSwordShadow3Rot" useTime="0.4" axis="0,1,0" degree="180" invert="0" restore="1" />
    <animMove id="animSwordShadow3Move" useTime="0.4" startPos="0,0,0" endPos="0,0,3" facing="0" />
    
    <!--==========================================================================-->
    <!--默认的UI动画-->
    <!--==========================================================================-->
    <animMove id="animViewMove" useTime="0.3" startPosOffset="0,-70,0" endPosOffset="0,0,0" motionType="Bezier" bezierFactor="0,0,1.5,1"
              facing="0" />
    
    <!--==========================================================================-->
    <!--野兽召唤-->
    <!--==========================================================================-->
    <animRotation id="animMagicCircleRotY" useTime="4" loop="loop" axis="0,1,0" degree="360" invert="0" />
    <animScale id="animMagicCircleScaleS" useTime="0.5"  startScale="0.01,0.01,0.01" endScale="1,1,1" motionType="Bezier" bezierFactor="0,0,1.5,1" />
    <animScale id="animMagicCircleScaleH" useTime="0.3" startScale="0.9,0.9,0.9" endScale="0.01,0.01,0.01" />
    <animColor id="animMagicCircleColor" useTime="0.5" loop="cycle"  startColor="3,3,3,1" endColor="0.3,0.3,0.3,0.3" />
    <animRotation id="animMagicCircleHaloRotY" useTime="4" loop="loop" axis="0,1,0" degree="360" invert="1" />
    <animScale id="animMagicCircleHaloScaleS" useTime="0.5"  startScale="0.01,0.01,0.01" endScale="1,1,1" motionType="Bezier" bezierFactor="0,0,1.5,1" />
    <animScale id="animMagicCircleHaloScaleH" useTime="0.3" startScale="1,1,1" endScale="0.01,0.01,0.01" />
    
    <!--==========================================================================-->
    <!--星光传送-->
    <!--==========================================================================-->
    <animScale id="animBackTownHaloScaleS" extends="animCommonScaleS" useTime="0.5" />
    <animScale id="animBackTownHaloScaleH" extends="animCommonScaleH" useTime="0.15" />
    <animScale id="animBackTownScaleS" extends="animCommonScaleS" useTime="0.5" />
    <animRotation id="animBackTownCircle" useTime="1.8" loop="loop" axis="0,1,0" degree="360" invert="0" />
    <animColor id="animBackTownColor" useTime="0.33" loop="cycle" startColor="3,3,3,1" endColor="0.75,0.75,0.75,0.75" />
    
    <!--==========================================================================-->
    <!--晕眩：金星旋转-->
    <!--==========================================================================-->
    <animRotation id="animStateStunRot" useTime="6" loop="loop" axis="0,1,0" degree="360" invert="0" />
    
    <!--==========================================================================-->
    <!--闪电箭:闪光的出现-->
    <!--==========================================================================-->
    <animRotation id="animLightningShotRot" useTime="1" loop="loop" axis="0,0,1" degree="360" invert="1" />
    <animScale id="animLightningShotRotScale" useTime="1" startScale="1,1,1" endScale="0.01,0.01,0.01" />
    <animScale id="animLightningShotFlareScaleShow" useTime="0.3" startScale="10,10,10"  endScale="0.02,0.02,0.02" />
    <animRotation id="animLightningShotRot" useTime="0.64" loop="loop" axis="0,0,1" degree="360" invert="1" />
    
    <!--==========================================================================-->
    <!--疾风步-->
    <!--==========================================================================-->
    <animRotation id="animStateWindWalkStartRot" useTime="1" loop="loop" axis="0,1,0" degree="360" invert="0" />
    <animScale id="animStateWindWalkStartScale" useTime="1" startScale="1,1,1" endScale="0.1,0.1,0.1" />
    
    <!--==========================================================================-->
    <!--落樱飞舞-->
    <!--==========================================================================-->
    <animRotation id="animDanceSakuraRot" useTime="2.3" loop="loop" axis="0,0,1" degree="720" invert="0" />
    <animColor id="animDanceSakuraColor" useTime="0.3" startColor="0,0,0,0"    endColor="3,3,3,3" />
    <animScale id="animDanceSakuraScaleHide" useTime="0.3" startScale="10,10,10" endScale="0.02,0.02,1" />
    <animScale id="animDanceSakuraMagicStartScale" useTime="0.3" startScale="0.1,0.1,0.1" endScale="1.2,1.2,1.2" motionType="Bezier" bezierFactor="0,0,1.5,1" />
    <animScale id="animDanceSakuraMagicEndScale" useTime="0.3" loop="dontLoop" startScale="1.2,1.2,1.2" endScale="0.1,0.1,0.1" />
    <animColor id="animDanceSakuraMagicStartColor" useTime="0.3" loop="dontLoop" startColor="0.5,0.5,0.5,0.5" endColor="3,3,3,1" />
    <animColor id="animDanceSakuraMagicDisplayColor" useTime="0.33" loop="cycle" startColor="3,3,3,1" endColor="0.75,0.75,0.75,0.75" />
    <animScale id="animDanceSakuraDirtShow" useTime="0.5"  startScale="0.01,0.01,0.01" endScale="4,2,4" />

    <!--==========================================================================-->
    <!--冲击波-->
    <!--==========================================================================-->
    <!--子弹的旋转-->
    <animRotation id="animWave" useTime="1.66" loop="loop" axis="0,0,1" degree="360" invert="0" />
    <!--卷起的烟雾-->
    <animRotation id="animWaveSmokeRot" useTime="2" loop="loop" axis="0,1,0" degree="360" invert="0" />
    <animScale id="animWaveSmokeScale"  useTime="3" startScale="0.2,0.2,0.2" endScale="2,2,2" />
    
    <!--==========================================================================-->
    <!--黄金宝箱：倒计时面板出现时的动画-->
    <!--==========================================================================-->
    <animCurveMove id="animTreasureTimer" useTime="0.75" useSine="1" waypoints="positionTreasureP1,positionTreasureP2,positionTreasureP3,positionTreasureP4" />

    <!--==========================================================================-->
    <!--冰冻特效：effectFrozenIce冰柱的随机旋转,使用时间非常小，所以不会看到旋转动画
    只是为获得一个随机旋转角度。让每次释放冰柱的时候都使用随机旋转-->
    <!--==========================================================================-->
    <animScale id="animFrozenIceScale" extends="animCommonScaleS" useTime="0.3" />
    <animRandomRotation id="animFrozenIceRot" useTime="0.3" minDegree="180" maxDegree="360" axis="0,1,0" />
    
    <!--==========================================================================-->
    <!--复活术-->
    <!--==========================================================================-->
    <animScale id="animRebornScaleS" extends="animCommonScaleS" useTime="0.5" />
    <animRotation id="animRebornRot" extends="animCommonRotY" useTime="0.5" />
    <animScale id="animRebornScaleH" extends="animCommonScaleH" useTime="0.3" />
    
    <!--==========================================================================-->
    <!--学习技能: effectLearnSkill-->
    <!--==========================================================================-->
    <animRotation id="animLearnSkillRotY" useTime="4" loop="loop" axis="0,1,0" degree="360" invert="0" />
    
    <!--冰霜减速状态的动画-->
    <animColor id="animColorFrost" useTime="0.5" startColor="0.5,0.5,1,1" endColor="0.75,0.75,1,1" loop="cycle" />
</root>



